{"allow_exclusions":false,"claim_lanes":{"E1":{"claim_kind":"exact_full_domain_existential_same_tuple","permitted_wording":"The full frozen scene domain contains at least one pair of graph-inequivalent interpretations with the same rendered observation; therefore no deterministic decoder is exact on every scene in that domain.","proof_obligations":["the witness tuple is a member of the unchanged parent tuple domain","both interpretation indices are members of the complete parent interpretation set I(q)","scene rendering is definitionally independent of interpretation index","the two canonical graphs are not equivalent","the instantiated Lean theorem has no axioms"],"resource_gate":{"maximum_artifact_bytes":2147483648,"maximum_oom_events":0,"maximum_peak_rss_bytes":4294967296,"maximum_temporary_bytes":2147483648,"maximum_wall_seconds":600,"workers":4},"witness_plan":{"antialias_profile":"box_2x2","cap":"round","half_length":85,"interpretation_indices":[0,1],"motif_ordinal":25,"reflection":"none","rotation_index":0,"scale_index":3,"width_px":5}},"E2":{"claim_kind":"exact_full_domain_existential_cross_tuple_full_bytes","permitted_wording":"The full frozen tuple domain contains the preregistered cross-tuple pairs whose complete canonical Gray8 observations are byte-for-byte equal while the selected graphs are not equivalent; therefore the frozen observation map is not injective up to graph equivalence.","proof_obligations":["all sixteen tuples are members of the unchanged parent tuple domain","both independent verifiers reconstruct tuples and interpretations from the parent contract","both independent verifiers rerender raw and padded canvases without importing producer implementations","canonical raster equality is complete byte equality and not digest equality","the selected canonical graphs are not equivalent","all eight preregistered pairs pass or E2 is NO_GO"],"resource_gate":{"maximum_artifact_bytes":2147483648,"maximum_oom_events":0,"maximum_peak_rss_bytes":8589934592,"maximum_temporary_bytes":17179869184,"maximum_wall_seconds":1800,"workers":4},"witness_plan":{"antialias_profile":"binary_1x","caps":["butt","square"],"left_fixed":{"half_length":62,"interpretation_index":0,"motif_ordinal":11,"reflection":"none","rotation_index":0,"scale_index":2},"right_fixed":{"half_length":93,"interpretation_index":0,"motif_ordinal":48,"reflection":"none","rotation_index":4,"scale_index":0},"width_px":[2,4,6,8],"witness_pair_count":8}},"Q":{"claim_kind":"exact_full_closure_over_proved_quotient","k_overflow_policy":"If K exceeds maximum_quotient_cardinality, reject Q before representative rendering; do not merge cells, sample K, narrow axes, or revise the bound in v0.6.","maximum_quotient_cardinality":100000,"permitted_wording":"Only after every Q obligation and every resource gate passes: the complete unchanged parent domain has the reported Raster, Evidence, and Graph closure through the proved quotient K.","proof_obligations":["a finite K and a surjection pi from every parent tuple to K are defined","pi cells are nonempty, pairwise disjoint, and their union is the entire parent domain","the proved K cardinality equals the enumerated K cardinality and does not exceed the frozen maximum","the canonical renderer factors through pi on every parent tuple","each quotient cell has a complete interpretation and graph-union summary","every element of K is enumerated exactly once","all Lean coverage and factorization theorems have no axioms","two independent verifiers agree on full-byte class identity and all closure roots"],"resource_gate":{"maximum_artifact_bytes":137438953472,"maximum_oom_events":0,"maximum_peak_rss_bytes":34359738368,"maximum_temporary_bytes":274877906944,"maximum_wall_seconds":14400,"workers":16}},"S":{"claim_kind":"preregistered_stratified_finite_population_statistics","permitted_wording":"For the preregistered predicates, the unchanged parent population has the reported stratified finite-population confidence bounds at the frozen simultaneous confidence level; this is not a full closure or a proof of a global collision rate.","resource_gate":{"maximum_artifact_bytes":17179869184,"maximum_oom_events":0,"maximum_peak_rss_bytes":17179869184,"maximum_temporary_bytes":68719476736,"maximum_wall_seconds":3600,"workers":16},"sample_plan":{"antialias_profiles":["binary_1x","box_2x2","box_4x4"],"confidence_level_ppm":990000,"familywise_method":"Bonferroni over every preregistered predicate and every stratum using finite-population bounds","motif_families":["s1","s2","s3","s4","s5","s6","s7","s8","c1","c2","c3","c4"],"sample_without_replacement":true,"samples_per_stratum":64,"seed_derivation":"SHA256 framed with the parent contract hash, v0.6 contract hash, and two 32-byte custodian shares committed before source freeze and revealed only after the sample implementation is frozen","stratum_count":108,"total_sample_count":6912,"width_buckets":[[1,2,3],[4,5,6],[7,8,9]]},"statistical_boundaries":["all selected tuple IDs and all failures remain in the denominator","deterministic axis-extrema sentinels are reported separately and excluded from estimates","zero observed failures is reported only as an upper confidence bound and never as a full-domain zero","sample duplicate counts describe only the sample and are not estimators of full ambiguity prevalence","a pair-collision rate is allowed only for a separately preregistered pair population and pair map","no optional stopping, replacement, predicate revision, stratum revision, or sample-size revision is permitted"]}},"contract_format":"closed canonical JSON instance; the validating schema is frozen before any v0.6 witness, sample, quotient, verifier, or result implementation","domain_binding":{"allow_exclusions":false,"exclusion_count":0,"frozen_quotient_tuple_count":36088416,"interpretation_scope":"all interpretations in the parent dependent set I(q), with no active or post-hoc validity predicate","parent_contract_path":"formal/chemgraph/challenge_v0_5/prereg/p0_contract_v0_5.json","parent_contract_sha256":"55ddcaacdf851166554ccd586b2a924c0e793f86cc7a6319f98132ef0ffb6b65","reuse_mode":"reference_only_no_copy_or_redefinition","scene_domain":"dependent pairs (q,i) for every q in the complete parent tuple domain and every i in I(q)","tuple_id_maximum":36088415,"tuple_id_minimum":0},"failure_policy":{"cross_lane_promotion_forbidden":true,"lane_failure_result":"NO_GO for that lane without weakening its claim, reducing its domain, changing its sample, merging quotient cells, or raising its resource gate","post_hoc_change_policy":"Any contract, schema, wording, resource, witness-plan, sample-plan, quotient-bound, or domain-binding change requires a new protocol version.","training_authorization_policy":"No E1, E2, S, or Q result in v0.6 authorizes training."},"independence":{"digest_role":"digests are commitments and indexes only; equality claims use complete canonical bytes","e1_logic_checker":"Lean kernel with every exported theorem checked by #print axioms and an empty axiom set","e2_and_q_minimum_independent_verifiers":2,"full_byte_identity_required":true,"network_allowed":false,"producer_verifier_shared_implementation_allowed":false,"shared_frozen_contract_allowed":true,"verifier_language_requirement":"For E2 and Q, at least one verifier uses a different implementation language or runtime from the producer.","verifier_recomputation":"Each verifier reconstructs domain membership, interpretation membership, canonical graphs, raster preprocessing when applicable, and the claimed relation from the frozen parent contract and source freeze."},"resource_accounting":{"artifact_definition":"all authoritative lane outputs including witnesses, full-byte sidecars, manifests, logs, and validation records","failure_rule":"exceeding any frozen maximum, any OOM event, nonzero exit, missing selected record, verifier disagreement, or unsafe artifact tree makes that lane NO_GO","rss_definition":"peak aggregate resident bytes for the complete cgroup or process tree","temporary_definition":"maximum allocated bytes in a dedicated initially empty work filesystem","wall_definition":"CLOCK_MONOTONIC elapsed time from first process start through final fsync and immutable publication","worker_definition":"the exact fixed worker count in the selected lane resource gate; GPU execution is forbidden"},"schema_version":"chemgraph-observation-closure-p0-v0.6","training_authorized":false}
